{"approved":0,"batchId":"batch-001","categoryId":"tahadani-016","evidenceCount":0,"integrityChecked":true,"issues":[],"questionCount":24,"released":0,"schemaVersion":"3.1.0","semanticEntailment":"human_review_required","sourceIdentities":[],"states":{"draft":0,"evidence_ready":0,"ready_for_human":24}}