{"approved":0,"batchId":"batch-001","categoryId":"tahadani-015","evidenceCount":24,"integrityChecked":true,"issues":[],"questionCount":24,"released":0,"schemaVersion":"3.1.0","semanticEntailment":"human_review_required","sourceIdentities":[{"canonicalUrl":"https://www.lahjah.com/web/pages/topics/fs_l-xhrf-alghin.php","id":"pilot-source-1e48ee36aeda98da00ada7e94ba7234c8f357e38c38e1978260d424bf59fc226","publisher":"Lahjah — Kuwaiti Dialect Dictionary","responseBodySha256":"849795da666a0d6de77f8910ff9f7de64c0cc4305d252d7096799485510dc3bc","sha256":"1e48ee36aeda98da00ada7e94ba7234c8f357e38c38e1978260d424bf59fc226","sourcePolicyId":"lahjah-kuwaiti-dictionary","title":":: Lahjah :: لهجة ::"},{"canonicalUrl":"https://www.lahjah.com/web/pages/topics/fs_l-xhrf-alsh651in.php","id":"pilot-source-51c4831ee0a2749e403c9688297cf9c1d5a566bf24df4f6f717dd1347996c1b8","publisher":"Lahjah — Kuwaiti Dialect Dictionary","responseBodySha256":"d60adaaa519d126f44ec79282ca80b7785433fecd635301d0e04005f686203f1","sha256":"51c4831ee0a2749e403c9688297cf9c1d5a566bf24df4f6f717dd1347996c1b8","sourcePolicyId":"lahjah-kuwaiti-dictionary","title":":: Lahjah :: لهجة ::"},{"canonicalUrl":"https://www.lahjah.com/web/pages/topics/fs_l-xhrf-almim.php","id":"pilot-source-e39043ba930d6538a309322671cd4853abac79ed1a7d78ec4e4e563c4303a97c","publisher":"Lahjah — Kuwaiti Dialect Dictionary","responseBodySha256":"906c6481f8ac6f3fc95e72f241fe3394912fdae90f992c52bad3faacfe8912ae","sha256":"e39043ba930d6538a309322671cd4853abac79ed1a7d78ec4e4e563c4303a97c","sourcePolicyId":"lahjah-kuwaiti-dictionary","title":":: Lahjah :: لهجة ::"}],"states":{"draft":0,"evidence_ready":0,"ready_for_human":24}}