{"approved":0,"batchId":"batch-001","categoryId":"tahadani-001","evidenceCount":72,"integrityChecked":true,"issues":[],"questionCount":24,"released":0,"schemaVersion":"3.1.0","semanticEntailment":"human_review_required","sourceIdentities":[{"canonicalUrl":"https://data.un.org/en/iso/td.html","id":"pilot-source-111bdb842b9ad31d9db19020f4227b6f8d5e47b2b6d004b706e510f68aefc9ea","publisher":"United Nations Statistics Division","responseBodySha256":"457915f846782a50cc1e76651e4b03394fe57e31b1542991fbf9e1c5bb89d0a2","sha256":"111bdb842b9ad31d9db19020f4227b6f8d5e47b2b6d004b706e510f68aefc9ea","sourcePolicyId":"un-data","title":"UNData app"},{"canonicalUrl":"https://data.un.org/en/iso/mw.html","id":"pilot-source-13300bfe1f47b7c78b145421566aa261794122a4a637bc0b24d6f79307cd3599","publisher":"United Nations Statistics Division","responseBodySha256":"6f701f286860d3c31605d415a0adbca63fb4a26b2307bd96c4b7855b4f56a1f7","sha256":"13300bfe1f47b7c78b145421566aa261794122a4a637bc0b24d6f79307cd3599","sourcePolicyId":"un-data","title":"UNData app"},{"canonicalUrl":"https://data.un.org/en/iso/lb.html","id":"pilot-source-1a915276134cec54b8b0f2e35d85d24cee6d2af748b9c8dc27ba3887e4fd306f","publisher":"United Nations Statistics Division","responseBodySha256":"8eebf481cd7a45bf29f518222cb325629b57c5da03fa9b3b14bd9f08b86e8600","sha256":"1a915276134cec54b8b0f2e35d85d24cee6d2af748b9c8dc27ba3887e4fd306f","sourcePolicyId":"un-data","title":"UNData app"},{"canonicalUrl":"https://data.un.org/en/iso/au.html","id":"pilot-source-2d75c57d340b0c454975737be3238cce4e8e9e00a71ac2fea29686692c918a0b","publisher":"United Nations Statistics Division","responseBodySha256":"d73819c3ca86fb3a8b5cb5ca75b81000f62a6eb0cf23d848289afd8c456de48c","sha256":"2d75c57d340b0c454975737be3238cce4e8e9e00a71ac2fea29686692c918a0b","sourcePolicyId":"un-data","title":"UNData app"},{"canonicalUrl":"https://data.un.org/en/iso/tj.html","id":"pilot-source-30f15cd244ccbc82cc61ad137966c00715b12761c2391e5e2e57c0a8b1ca0568","publisher":"United Nations Statistics Division","responseBodySha256":"37bb0b98a233aebe093def259363bb9f8290faf555fc7a23c7353b30af650120","sha256":"30f15cd244ccbc82cc61ad137966c00715b12761c2391e5e2e57c0a8b1ca0568","sourcePolicyId":"un-data","title":"UNData app"},{"canonicalUrl":"https://data.un.org/en/iso/ca.html","id":"pilot-source-4c207d13fb704ac3cde9f65a62142abc18f6fd410ea4af75401fc3ffebe08f23","publisher":"United Nations Statistics Division","responseBodySha256":"ff54bf67ea923a2854453b268233142f0e3e2217bc025090f53b6dcf2c13d465","sha256":"4c207d13fb704ac3cde9f65a62142abc18f6fd410ea4af75401fc3ffebe08f23","sourcePolicyId":"un-data","title":"UNData app"},{"canonicalUrl":"https://data.un.org/en/iso/fr.html","id":"pilot-source-5253f8f4adcbe095a1f9dee6c0eecbe03cce93a810be13a488d73d786ac3d1ad","publisher":"United Nations Statistics Division","responseBodySha256":"63006e6ad5728fcf7ad766b8bfe242bf34566fef4d8d7f30caeb144529202797","sha256":"5253f8f4adcbe095a1f9dee6c0eecbe03cce93a810be13a488d73d786ac3d1ad","sourcePolicyId":"un-data","title":"UNData app"},{"canonicalUrl":"https://data.un.org/en/iso/zm.html","id":"pilot-source-543210849d1ed14ebd8095b933f11ec221436d432731db07f2d3625dc79459a9","publisher":"United Nations Statistics Division","responseBodySha256":"147b74f77b12b15459d7316522390719dfabf2ab974d1b3689ae288c4d0fb503","sha256":"543210849d1ed14ebd8095b933f11ec221436d432731db07f2d3625dc79459a9","sourcePolicyId":"un-data","title":"UNData app"},{"canonicalUrl":"https://data.un.org/en/iso/dm.html","id":"pilot-source-59236d8f5b4039b234211c47cc981dc9e4136fbb77bc52662bdecd6d58d46246","publisher":"United Nations Statistics Division","responseBodySha256":"41f783713cecdc45422d4c9818f32c345913c00658187d6f9c68222826a6f474","sha256":"59236d8f5b4039b234211c47cc981dc9e4136fbb77bc52662bdecd6d58d46246","sourcePolicyId":"un-data","title":"UNData app"},{"canonicalUrl":"https://data.un.org/en/iso/km.html","id":"pilot-source-64cdf35d51a8098dca5f5ce7f8173de3ff7c97ad50db4a38249e4c15c6e411ed","publisher":"United Nations Statistics Division","responseBodySha256":"abd4bceed460c56e88ad483a3ba0f546d1af4a6a84fffeecf3b49fb8b1e0e36c","sha256":"64cdf35d51a8098dca5f5ce7f8173de3ff7c97ad50db4a38249e4c15c6e411ed","sourcePolicyId":"un-data","title":"UNData app"},{"canonicalUrl":"https://data.un.org/en/iso/dj.html","id":"pilot-source-7b60a3fae194c450e6957418a9684990b569ef3de4a1e36c44f20aa8dc903f7e","publisher":"United Nations Statistics Division","responseBodySha256":"488654a928689ff2c72dd5bc14778ef13e62efa46f96fbb825d4a8fa01e7666a","sha256":"7b60a3fae194c450e6957418a9684990b569ef3de4a1e36c44f20aa8dc903f7e","sourcePolicyId":"un-data","title":"UNData app"},{"canonicalUrl":"https://data.un.org/en/iso/om.html","id":"pilot-source-90506ca6480aeb004c870cf00f0cf64f39e4641d81bae7b8380243e38dc4274c","publisher":"United Nations Statistics Division","responseBodySha256":"b9994234c133cae8504e99659e4338d29a07fc5e591b87ffa1904666936aff33","sha256":"90506ca6480aeb004c870cf00f0cf64f39e4641d81bae7b8380243e38dc4274c","sourcePolicyId":"un-data","title":"UNData app"},{"canonicalUrl":"https://data.un.org/en/iso/np.html","id":"pilot-source-a54df13bfc73df73fbebf8567b6b66e9d307bb186f7dc79d0175192b368c13c2","publisher":"United Nations Statistics Division","responseBodySha256":"99ffd46a33f19dd44e288e65e8470bee7c7a1565bc16ab4492d67b27b0b6d7df","sha256":"a54df13bfc73df73fbebf8567b6b66e9d307bb186f7dc79d0175192b368c13c2","sourcePolicyId":"un-data","title":"UNData app"},{"canonicalUrl":"https://data.un.org/en/iso/gh.html","id":"pilot-source-a59c9cc44aa6db27473a3e2eff781e28934e52f69aa5ab1342359f436f05698a","publisher":"United Nations Statistics Division","responseBodySha256":"387963b1f9ea2d5c189bc14b739a1a855959ccf9c7eeb23d0b7f86ee69b905ba","sha256":"a59c9cc44aa6db27473a3e2eff781e28934e52f69aa5ab1342359f436f05698a","sourcePolicyId":"un-data","title":"UNData app"},{"canonicalUrl":"https://data.un.org/en/iso/rw.html","id":"pilot-source-b133dac4798758c75e1473beab0615a5e634219bcd46f668e951bf4ef4285137","publisher":"United Nations Statistics Division","responseBodySha256":"9a358657a3a99bf8c79321cad1e7aa97e9b94671816b5fd95933dee0cb9e0a17","sha256":"b133dac4798758c75e1473beab0615a5e634219bcd46f668e951bf4ef4285137","sourcePolicyId":"un-data","title":"UNData app"},{"canonicalUrl":"https://data.un.org/en/iso/hn.html","id":"pilot-source-b8c934c31269a7d69a011d28d02fa7d75104b84f6c6af08bcd396397c12766ee","publisher":"United Nations Statistics Division","responseBodySha256":"8d534252bba0098c6a1818bf05d3f033eb9feeac12ffdd6b269115b56b4c610b","sha256":"b8c934c31269a7d69a011d28d02fa7d75104b84f6c6af08bcd396397c12766ee","sourcePolicyId":"un-data","title":"UNData app"},{"canonicalUrl":"https://data.un.org/en/iso/eg.html","id":"pilot-source-d78434dd5ddcbc39c1b5fb1d274c1746c4fa82ece7b609a822a4abc2c6dc9f61","publisher":"United Nations Statistics Division","responseBodySha256":"f61428cc8f98d66478c2506110694c3ae5a8477f3bc504186a0152b408a3e3d9","sha256":"d78434dd5ddcbc39c1b5fb1d274c1746c4fa82ece7b609a822a4abc2c6dc9f61","sourcePolicyId":"un-data","title":"UNData app"},{"canonicalUrl":"https://data.un.org/en/iso/rs.html","id":"pilot-source-da5ebfd38e15a885560b8a99e177a818f3b777139530e538490d4e197a66ba1d","publisher":"United Nations Statistics Division","responseBodySha256":"3fdb0943e08575c31e5ba268e8996cd59974801555a576b9837276ddebcaba56","sha256":"da5ebfd38e15a885560b8a99e177a818f3b777139530e538490d4e197a66ba1d","sourcePolicyId":"un-data","title":"UNData app"},{"canonicalUrl":"https://data.un.org/en/iso/qa.html","id":"pilot-source-e33bfc2c26de53ec2018ceadfb0df5a69a8bc0e7d29ff56aac82619b67707c85","publisher":"United Nations Statistics Division","responseBodySha256":"7ebd8ff117c6da02c04e10e64caa115bf7b20939a7248bd6b5fca0487c227976","sha256":"e33bfc2c26de53ec2018ceadfb0df5a69a8bc0e7d29ff56aac82619b67707c85","sourcePolicyId":"un-data","title":"UNData app"},{"canonicalUrl":"https://data.un.org/en/iso/sr.html","id":"pilot-source-ecb06747f5283d5f0dcee3b5cc7732a88e1b295d73aa030b3f88ef17d9429cd0","publisher":"United Nations Statistics Division","responseBodySha256":"fa82ed388a9e9de7b062ddce41db2616c1172518f691ceace3eb90236f86f65f","sha256":"ecb06747f5283d5f0dcee3b5cc7732a88e1b295d73aa030b3f88ef17d9429cd0","sourcePolicyId":"un-data","title":"UNData app"},{"canonicalUrl":"https://data.un.org/en/iso/ve.html","id":"pilot-source-eddc13506b0b549272573724b3727dd0b52ba7fe028b8de392f55ca7626d0cef","publisher":"United Nations Statistics Division","responseBodySha256":"2a319c53266af21159ecbc03c4489d1d438ae231221053470d7b559c948307d6","sha256":"eddc13506b0b549272573724b3727dd0b52ba7fe028b8de392f55ca7626d0cef","sourcePolicyId":"un-data","title":"UNData app"},{"canonicalUrl":"https://data.un.org/en/iso/na.html","id":"pilot-source-f20695eea6a6a02761448e5aa276c47607e4c4496ee4f9880cfe7f2b8a083f6b","publisher":"United Nations Statistics Division","responseBodySha256":"511132c5a1cd7daee2af2c0c0f72e1925ba83e6160b4eb9a0abc822dbfff9d5e","sha256":"f20695eea6a6a02761448e5aa276c47607e4c4496ee4f9880cfe7f2b8a083f6b","sourcePolicyId":"un-data","title":"UNData app"},{"canonicalUrl":"https://data.un.org/en/iso/pk.html","id":"pilot-source-f24e999bef0d70b59d2832359c9e5364efc64b6b5cfe4e4441008d0ef76001e7","publisher":"United Nations Statistics Division","responseBodySha256":"331b364b2c881e37f015e0e9b079289345effe10d3e7967033953206231cd757","sha256":"f24e999bef0d70b59d2832359c9e5364efc64b6b5cfe4e4441008d0ef76001e7","sourcePolicyId":"un-data","title":"UNData app"},{"canonicalUrl":"https://data.un.org/en/iso/sk.html","id":"pilot-source-fa48200f662b1ea3634dc18a8df0c72924b49e7c738394ea6c3b3ae314e920ff","publisher":"United Nations Statistics Division","responseBodySha256":"6e2164cce02a23a9ac3b934206c691496da4491d137f97ba69b0bf402a1fd075","sha256":"fa48200f662b1ea3634dc18a8df0c72924b49e7c738394ea6c3b3ae314e920ff","sourcePolicyId":"un-data","title":"UNData app"}],"states":{"draft":0,"evidence_ready":0,"ready_for_human":24}}