{"approved":0,"batchId":"batch-001","categoryId":"tahadani-007","evidenceCount":32,"integrityChecked":true,"issues":[],"questionCount":24,"released":0,"schemaVersion":"3.1.0","semanticEntailment":"human_review_required","sourceIdentities":[{"canonicalUrl":"https://animals.sandiegozoo.org/animals/flamingo","id":"pilot-source-22363111fc01c4b23294db515d3e66e7537c6c93a4a31ca38987410d0ace8764","publisher":"San Diego Zoo Wildlife Alliance","responseBodySha256":"e20fef15918a541b8b07e0c0aceec1c1a0fb445c29f4340eeb4afdb1b7fac607","sha256":"22363111fc01c4b23294db515d3e66e7537c6c93a4a31ca38987410d0ace8764","sourcePolicyId":"san-diego-zoo","title":"Flamingo | San Diego Zoo Animals &amp; Plants"},{"canonicalUrl":"https://animals.sandiegozoo.org/animals/two-toed-sloth","id":"pilot-source-28d2197562361af94f7cf89c4cb5a028ab3a7429499cb120dc2e45af37a02605","publisher":"San Diego Zoo Wildlife Alliance","responseBodySha256":"71dfd2e5b62498d4c070e5fedc28203fdb0edf0682c6b61809bc443485494257","sha256":"28d2197562361af94f7cf89c4cb5a028ab3a7429499cb120dc2e45af37a02605","sourcePolicyId":"san-diego-zoo","title":"Two-toed Sloth | San Diego Zoo Animals &amp; Plants"},{"canonicalUrl":"https://animals.sandiegozoo.org/animals/pelican","id":"pilot-source-372187f7cc6bc2dfbe31e44b4253ef2d116aef71804a29b0a1547ea944b73128","publisher":"San Diego Zoo Wildlife Alliance","responseBodySha256":"c6cb7a78d358e8b12b60829c6ce5d0b6fed62aed450c9c9ceabd5153f7c93b81","sha256":"372187f7cc6bc2dfbe31e44b4253ef2d116aef71804a29b0a1547ea944b73128","sourcePolicyId":"san-diego-zoo","title":"Pelican | San Diego Zoo Animals &amp; Plants"},{"canonicalUrl":"https://animals.sandiegozoo.org/animals/ant","id":"pilot-source-372af81597be2cee8310fc53097aaecd41b78f2e7fbaaaa4192d32990ee7fd8e","publisher":"San Diego Zoo Wildlife Alliance","responseBodySha256":"3b73ab80f100dc50e6cfd25fd844f7864b86bd24fa74683167d902395bed55a9","sha256":"372af81597be2cee8310fc53097aaecd41b78f2e7fbaaaa4192d32990ee7fd8e","sourcePolicyId":"san-diego-zoo","title":"Ant | San Diego Zoo Animals &amp; Plants"},{"canonicalUrl":"https://nationalzoo.si.edu/animals/news/50-panda-facts-celebrate-50-years-giant-pandas-smithsonians-national-zoo","id":"pilot-source-3b76935fc6ef497162f6d61e1fc79c5a694f635d3a746277aeac70338f3e9d7f","publisher":"Smithsonian’s National Zoo","responseBodySha256":"dbb2fc06e75d16a8326926b0b9a73008253518b7aa8b36150f7454bfca50b66d","sha256":"3b76935fc6ef497162f6d61e1fc79c5a694f635d3a746277aeac70338f3e9d7f","sourcePolicyId":"smithsonian-national-zoo","title":"50 Panda Facts to Celebrate 50 Years of Giant Pandas at the Smithsonian&#039;s National Zoo | Smithsonian&#039;s National Zoo and Conservation Biology Institute"},{"canonicalUrl":"https://animals.sandiegozoo.org/animals/camel","id":"pilot-source-3d80fa082cf7693ec9dd29a7b5895c869c323d3bd89511e4834a6e09677a79d9","publisher":"San Diego Zoo Wildlife Alliance","responseBodySha256":"5fa676b364b97a0a23001c621ce4088e54c08aa01964e07da6fc9be9e3341928","sha256":"3d80fa082cf7693ec9dd29a7b5895c869c323d3bd89511e4834a6e09677a79d9","sourcePolicyId":"san-diego-zoo","title":"Camel | San Diego Zoo Animals &amp; Plants"},{"canonicalUrl":"https://nationalzoo.si.edu/animals/red-panda","id":"pilot-source-50b93afd28131757fffd220d20af66bfc16d84cbc29daac829e82970dbc6cf76","publisher":"Smithsonian’s National Zoo","responseBodySha256":"b7ed9535dfb0f6fcf5e105823193d7596b394245fc9841413d490f64fc858b49","sha256":"50b93afd28131757fffd220d20af66bfc16d84cbc29daac829e82970dbc6cf76","sourcePolicyId":"smithsonian-national-zoo","title":"Red panda | Smithsonian&#039;s National Zoo and Conservation Biology Institute"},{"canonicalUrl":"https://nationalzoo.si.edu/animals/asian-elephant","id":"pilot-source-63850b4902d256543ce325827c65398abab31debb2740ac2dcde9f0ab46aad17","publisher":"Smithsonian’s National Zoo","responseBodySha256":"4e9b1d9515140e533a1345953ee06b9ac284c3ff6be0119eaa2981e9b519fe83","sha256":"63850b4902d256543ce325827c65398abab31debb2740ac2dcde9f0ab46aad17","sourcePolicyId":"smithsonian-national-zoo","title":"Asian elephant | Smithsonian&#039;s National Zoo and Conservation Biology Institute"},{"canonicalUrl":"https://nationalzoo.si.edu/animals/news/jumping-joy-meet-zoos-new-baby-wallaby","id":"pilot-source-6f2cd334932112fdea2cec0a44fee8818b64050807728667cde88681365e2b3d","publisher":"Smithsonian’s National Zoo","responseBodySha256":"cf1bfea3604ad0fea91a089b9df95c9929032acf47706435f4678c54d39a69f2","sha256":"6f2cd334932112fdea2cec0a44fee8818b64050807728667cde88681365e2b3d","sourcePolicyId":"smithsonian-national-zoo","title":"Jumping for Joy: Meet the Zoo’s New Baby Wallaby | Smithsonian&#039;s National Zoo and Conservation Biology Institute"},{"canonicalUrl":"https://nationalzoo.si.edu/animals/news/why-are-flamingos-pink-and-other-flamingo-facts","id":"pilot-source-902c6d66bbe45477aa65e350410a6070c25499a69cf711a701641d874c10bb94","publisher":"Smithsonian’s National Zoo","responseBodySha256":"75d6752f5d1f6c348b867f3ef69cd1aa950ec18203376ea3398d55cb3cfe4909","sha256":"902c6d66bbe45477aa65e350410a6070c25499a69cf711a701641d874c10bb94","sourcePolicyId":"smithsonian-national-zoo","title":"Why Are Flamingos Pink? And Other Flamingo Facts | Smithsonian&#039;s National Zoo and Conservation Biology Institute"},{"canonicalUrl":"https://animals.sandiegozoo.org/animals/kangaroo-and-wallaby","id":"pilot-source-92f2f3aa613d23343acb9b0da02f8d8e81ccd721c201a2aa3f5b7a7f00273186","publisher":"San Diego Zoo Wildlife Alliance","responseBodySha256":"f952db3dcddd7862e15d804fb1e6ac5b1f9766955676d946f4c966e23b44bfeb","sha256":"92f2f3aa613d23343acb9b0da02f8d8e81ccd721c201a2aa3f5b7a7f00273186","sourcePolicyId":"san-diego-zoo","title":"Kangaroo and Wallaby | San Diego Zoo Animals &amp; Plants"},{"canonicalUrl":"https://animals.sandiegozoo.org/animals/platypus","id":"pilot-source-a36eb71281b3f5df3097d96a499293a1da61f482a82f9234e08694c9fa557de3","publisher":"San Diego Zoo Wildlife Alliance","responseBodySha256":"a67829649192c8b49fef1f78266a76871329995404d27496455d89a97ce2b6fd","sha256":"a36eb71281b3f5df3097d96a499293a1da61f482a82f9234e08694c9fa557de3","sourcePolicyId":"san-diego-zoo","title":"Platypus | San Diego Zoo Animals &amp; Plants"},{"canonicalUrl":"https://animals.sandiegozoo.org/animals/whale","id":"pilot-source-b18ecfbb20d1ce3de6c79e2a577142dda4dd18b339354a4f218a7e4e6f9a52bd","publisher":"San Diego Zoo Wildlife Alliance","responseBodySha256":"1be5172d97d5262436f17cf3baa76dcfdb3d077e8ec570e31c1a3a407f7e744d","sha256":"b18ecfbb20d1ce3de6c79e2a577142dda4dd18b339354a4f218a7e4e6f9a52bd","sourcePolicyId":"san-diego-zoo","title":"Whale | San Diego Zoo Animals &amp; Plants"},{"canonicalUrl":"https://animals.sandiegozoo.org/animals/leopard-shark","id":"pilot-source-b20ec3545bfce3834bcc3f5aaa2db119a9a115af5b0b5092a54a03877ee64838","publisher":"San Diego Zoo Wildlife Alliance","responseBodySha256":"9c5da3822f6d1a41267ff0737f32955881392d727757ff0a24908f0b56bd03b1","sha256":"b20ec3545bfce3834bcc3f5aaa2db119a9a115af5b0b5092a54a03877ee64838","sourcePolicyId":"san-diego-zoo","title":"Leopard Shark | San Diego Zoo Animals &amp; Plants"},{"canonicalUrl":"https://animals.sandiegozoo.org/animals/bee","id":"pilot-source-ba4bb177cffdf856647e2eb8c6603752564b30b0b94be3251a0d18dba6aa5565","publisher":"San Diego Zoo Wildlife Alliance","responseBodySha256":"723b09b18535c973c52ca190cfdf090f8f8b526345d3d9613fd166bf2216fca1","sha256":"ba4bb177cffdf856647e2eb8c6603752564b30b0b94be3251a0d18dba6aa5565","sourcePolicyId":"san-diego-zoo","title":"Bee | San Diego Zoo Animals &amp; Plants"},{"canonicalUrl":"https://nationalzoo.si.edu/animals/news/training-swarna-tooth-radiographs","id":"pilot-source-c7751c4844beebf1b5f6f817884da11fd79cb589663f71714af9cc830c029c97","publisher":"Smithsonian’s National Zoo","responseBodySha256":"ba0fc665c0bf9359726ec015cb95d761a1de0151b60f1733bd0c8effe1a9bb7d","sha256":"c7751c4844beebf1b5f6f817884da11fd79cb589663f71714af9cc830c029c97","sourcePolicyId":"smithsonian-national-zoo","title":"Training Swarna for Tooth Radiographs | Smithsonian&#039;s National Zoo and Conservation Biology Institute"},{"canonicalUrl":"https://nationalzoo.si.edu/animals/giant-panda","id":"pilot-source-dbcef9554a27649f798724bb653609a25c67960356d3f652855e28bc5a444527","publisher":"Smithsonian’s National Zoo","responseBodySha256":"e105237f3267d3b504be9b7deb4666723666d9cee8b2f05d1f0ffec26cf48345","sha256":"dbcef9554a27649f798724bb653609a25c67960356d3f652855e28bc5a444527","sourcePolicyId":"smithsonian-national-zoo","title":"Giant panda | Smithsonian&#039;s National Zoo and Conservation Biology Institute"}],"states":{"draft":0,"evidence_ready":0,"ready_for_human":24}}